{
  "$schema": "https://raw.githubusercontent.com/hidane-dev/benchmark-results/main/metrics/schema.json",
  "schema_version": 1,
  "date": "2026-10-16",
  "generated_at": "2026-10-16T11:52:36Z",
  "github": {
    "hidane-dev/hidane": {
      "stars": {
        "value": 3,
        "source": "https://api.github.com/repos/hidane-dev/hidane",
        "fetched_at": "2026-10-16T11:52:36Z"
      },
      "forks": {
        "value": 0,
        "source": "https://api.github.com/repos/hidane-dev/hidane",
        "fetched_at": "2026-10-16T11:52:36Z"
      },
      "watchers": {
        "value": 0,
        "source": "https://api.github.com/repos/hidane-dev/hidane",
        "fetched_at": "2026-10-16T11:52:36Z"
      },
      "release_downloads": {
        "value": {
          "archive_downloads": 1450,
          "releases": [
            {
              "tag": "v0.6.0",
              "published_at": "2026-10-15T22:09:27Z",
              "prerelease": false,
              "archive_downloads": 102,
              "assets": [
                {
                  "name": "hidane-0.6.0-aarch64-apple-darwin.cdx.json",
                  "downloads": 1
                },
                {
                  "name": "hidane-0.6.0-aarch64-apple-darwin.tar.gz",
                  "downloads": 5
                },
                {
                  "name": "hidane-0.6.0-aarch64-unknown-linux-musl.cdx.json",
                  "downloads": 1
                },
                {
                  "name": "hidane-0.6.0-aarch64-unknown-linux-musl.tar.gz",
                  "downloads": 3
                },
                {
                  "name": "hidane-0.6.0-x86_64-apple-darwin.cdx.json",
                  "downloads": 1
                },
                {
                  "name": "hidane-0.6.0-x86_64-apple-darwin.tar.gz",
                  "downloads": 1
                },
                {
                  "name": "hidane-0.6.0-x86_64-pc-windows-msvc.cdx.json",
                  "downloads": 1
                },
                {
                  "name": "hidane-0.6.0-x86_64-pc-windows-msvc.zip",
                  "downloads": 3
                },
                {
                  "name": "hidane-0.6.0-x86_64-unknown-linux-musl.cdx.json",
                  "downloads": 2
                },
                {
                  "name": "hidane-0.6.0-x86_64-unknown-linux-musl.tar.gz",
                  "downloads": 90
                },
                {
                  "name": "hidane-0.6.0.intoto.jsonl",
                  "downloads": 1
                },
                {
                  "name": "sha256sums.txt",
                  "downloads": 91
                }
              ]
            },
            {
              "tag": "v0.5.1",
              "published_at": "2026-10-13T14:55:47Z",
              "prerelease": false,
              "archive_downloads": 702,
              "assets": [
                {
                  "name": "hidane-0.5.1-aarch64-apple-darwin.cdx.json",
                  "downloads": 3
                },
                {
                  "name": "hidane-0.5.1-aarch64-apple-darwin.tar.gz",
                  "downloads": 14
                },
                {
                  "name": "hidane-0.5.1-aarch64-unknown-linux-musl.cdx.json",
                  "downloads": 3
                },
                {
                  "name": "hidane-0.5.1-aarch64-unknown-linux-musl.tar.gz",
                  "downloads": 7
                },
                {
                  "name": "hidane-0.5.1-x86_64-apple-darwin.cdx.json",
                  "downloads": 3
                },
                {
                  "name": "hidane-0.5.1-x86_64-apple-darwin.tar.gz",
                  "downloads": 5
                },
                {
                  "name": "hidane-0.5.1-x86_64-pc-windows-msvc.cdx.json",
                  "downloads": 3
                },
                {
                  "name": "hidane-0.5.1-x86_64-pc-windows-msvc.zip",
                  "downloads": 9
                },
                {
                  "name": "hidane-0.5.1-x86_64-unknown-linux-musl.cdx.json",
                  "downloads": 4
                },
                {
                  "name": "hidane-0.5.1-x86_64-unknown-linux-musl.tar.gz",
                  "downloads": 667
                },
                {
                  "name": "hidane-0.5.1.intoto.jsonl",
                  "downloads": 3
                },
                {
                  "name": "sha256sums.txt",
                  "downloads": 569
                }
              ]
            },
            {
              "tag": "v0.5.0",
              "published_at": "2026-10-13T10:29:40Z",
              "prerelease": false,
              "archive_downloads": 124,
              "assets": [
                {
                  "name": "hidane-0.5.0-aarch64-apple-darwin.cdx.json",
                  "downloads": 1
                },
                {
                  "name": "hidane-0.5.0-aarch64-apple-darwin.tar.gz",
                  "downloads": 21
                },
                {
                  "name": "hidane-0.5.0-aarch64-unknown-linux-musl.cdx.json",
                  "downloads": 1
                },
                {
                  "name": "hidane-0.5.0-aarch64-unknown-linux-musl.tar.gz",
                  "downloads": 8
                },
                {
                  "name": "hidane-0.5.0-x86_64-apple-darwin.cdx.json",
                  "downloads": 1
                },
                {
                  "name": "hidane-0.5.0-x86_64-apple-darwin.tar.gz",
                  "downloads": 6
                },
                {
                  "name": "hidane-0.5.0-x86_64-pc-windows-msvc.cdx.json",
                  "downloads": 1
                },
                {
                  "name": "hidane-0.5.0-x86_64-pc-windows-msvc.zip",
                  "downloads": 12
                },
                {
                  "name": "hidane-0.5.0-x86_64-unknown-linux-musl.cdx.json",
                  "downloads": 2
                },
                {
                  "name": "hidane-0.5.0-x86_64-unknown-linux-musl.tar.gz",
                  "downloads": 77
                },
                {
                  "name": "hidane-0.5.0.intoto.jsonl",
                  "downloads": 1
                },
                {
                  "name": "sha256sums.txt",
                  "downloads": 99
                }
              ]
            },
            {
              "tag": "v0.4.0",
              "published_at": "2026-10-13T00:19:51Z",
              "prerelease": false,
              "archive_downloads": 202,
              "assets": [
                {
                  "name": "hidane-0.4.0-aarch64-apple-darwin.tar.gz",
                  "downloads": 31
                },
                {
                  "name": "hidane-0.4.0-aarch64-unknown-linux-musl.tar.gz",
                  "downloads": 10
                },
                {
                  "name": "hidane-0.4.0-x86_64-apple-darwin.tar.gz",
                  "downloads": 9
                },
                {
                  "name": "hidane-0.4.0-x86_64-pc-windows-msvc.zip",
                  "downloads": 14
                },
                {
                  "name": "hidane-0.4.0-x86_64-unknown-linux-musl.tar.gz",
                  "downloads": 138
                },
                {
                  "name": "sha256sums.txt",
                  "downloads": 176
                }
              ]
            },
            {
              "tag": "v0.3.0",
              "published_at": "2026-10-12T21:37:04Z",
              "prerelease": false,
              "archive_downloads": 93,
              "assets": [
                {
                  "name": "hidane-0.3.0-aarch64-apple-darwin.tar.gz",
                  "downloads": 22
                },
                {
                  "name": "hidane-0.3.0-aarch64-unknown-linux-musl.tar.gz",
                  "downloads": 16
                },
                {
                  "name": "hidane-0.3.0-x86_64-apple-darwin.tar.gz",
                  "downloads": 14
                },
                {
                  "name": "hidane-0.3.0-x86_64-pc-windows-msvc.zip",
                  "downloads": 18
                },
                {
                  "name": "hidane-0.3.0-x86_64-unknown-linux-musl.tar.gz",
                  "downloads": 23
                },
                {
                  "name": "sha256sums.txt",
                  "downloads": 74
                }
              ]
            },
            {
              "tag": "v0.2.4",
              "published_at": "2026-10-12T17:42:56Z",
              "prerelease": false,
              "archive_downloads": 21,
              "assets": [
                {
                  "name": "hidane-0.2.4-aarch64-apple-darwin.tar.gz",
                  "downloads": 7
                },
                {
                  "name": "hidane-0.2.4-aarch64-unknown-linux-musl.tar.gz",
                  "downloads": 3
                },
                {
                  "name": "hidane-0.2.4-x86_64-apple-darwin.tar.gz",
                  "downloads": 1
                },
                {
                  "name": "hidane-0.2.4-x86_64-pc-windows-msvc.zip",
                  "downloads": 3
                },
                {
                  "name": "hidane-0.2.4-x86_64-unknown-linux-musl.tar.gz",
                  "downloads": 7
                },
                {
                  "name": "sha256sums.txt",
                  "downloads": 11
                }
              ]
            },
            {
              "tag": "v0.2.3",
              "published_at": "2026-10-12T16:35:10Z",
              "prerelease": false,
              "archive_downloads": 35,
              "assets": [
                {
                  "name": "hidane-0.2.3-aarch64-apple-darwin.tar.gz",